{
  "schema_version": "1.0",
  "network_name": "wc-oci-vm-net",
  "edge_project": "wc-edge-oci",
  "app_project": "wc-app-oci",
  "edge": [
    {
      "name": "caddy",
      "image": "local/caddy:2.8.4",
      "ports": ["80:80", "443:443"],
      "volumes_spec": ["caddyfile_bind", "caddy_data", "caddy_config"],
      "depends_on": ["keycloak"],
      "restart": "unless-stopped"
    },
    {
      "name": "keycloak",
      "image": "local/keycloak:26.0.5",
      "label_role": "identity",
      "command": ["start-dev"],
      "env_file": ["${KEYCLOAK_ENV_FILE}"],
      "environment": {
        "KC_PROXY_HEADERS": "xforwarded",
        "KC_HTTP_ENABLED": "true",
        "KC_HTTP_RELATIVE_PATH": "/auth",
        "KC_HOSTNAME": "auth.worldcliques.org",
        "KC_HOSTNAME_STRICT": "false",
        "KC_HOSTNAME_URL": "${KEYCLOAK_PUBLIC_URL:-https://auth.worldcliques.org/auth}",
        "KC_HOSTNAME_ADMIN_URL": "${KEYCLOAK_PUBLIC_URL:-https://auth.worldcliques.org/auth}"
      },
      "restart": "unless-stopped"
    }
  ],
  "application": [
    {
      "name": "default-html",
      "image": "local/default-html:0.0.6",
      "optional": true,
      "config_flag": "default-html",
      "environment": { "BASIC_HTTP_ROOT": "/srv/www", "PORT": "8080" },
      "volumes_spec": ["globe_assets_bind"],
      "restart": "unless-stopped"
    },
    {
      "name": "default-api-json",
      "image": "local/default-api-json:0.0.3",
      "optional": true,
      "config_flag": "default-api-json",
      "environment": { "PORT": "8080", "CORS_ALLOW_ORIGINS": "*" },
      "restart": "unless-stopped"
    },
    {
      "name": "globe-landing",
      "image": "local/globe-landing:0.0.2",
      "optional": true,
      "config_flag": "globe-landing",
      "environment": { "PORT": "8080" },
      "restart": "unless-stopped"
    }
  ]
}
